{
  "contract_version": "performance-request.v1",
  "request_id": "req_01JTEST0001",
  "run_id": "run_01JTEST0001",
  "sample_index": 1,
  "provider": {
    "provider_id": "northstar_demo",
    "endpoint": "https://api.example.com/v1/chat/completions",
    "protocol": "openai-chat-completions",
    "credential_ref": "env:NORTHSTAR_API_KEY",
    "adapter": "openai-compatible"
  },
  "model": "gpt-5.2",
  "mode": "streaming",
  "timeout_ms": 30000,
  "input": {
    "messages": [
      { "role": "system", "content": "Reply concisely." },
      { "role": "user", "content": "Return the word ready." }
    ]
  },
  "parameters": {
    "temperature": 0,
    "max_output_tokens": 32,
    "seed": 42
  },
  "metadata": {
    "test_case_id": "latency-smoke-v1",
    "tags": ["smoke", "streaming"]
  },
  "created_at": "2026-09-05T06:02:00Z"
}
